[
  {
    "name": "Axamer Lizum",
    "lat": 47.195,
    "lon": 11.281,
    "sct": true,
    "ssc": false,
    "region": "Tirol",
    "country": "Austria",
    "website": "https://www.axamer-lizum.at",
    "groupId": "axamer-lizum",
    "groupName": "Axamer Lizum",
    "entryType": "main",
    "entryName": "Axamer Lizum"
  },
  {
    "name": "Berwang/Bichlbach – Berwanger Sonnalmbahn",
    "lat": 47.391,
    "lon": 10.692,
    "sct": true,
    "ssc": false,
    "region": "Tirol",
    "country": "Austria",
    "website": "https://www.berwang.tirol",
    "groupId": "berwang",
    "groupName": "Berwang",
    "entryType": "entry",
    "entryName": "Bichlbach er Sonnalmbahn"
  },
  {
    "name": "Biberwier – Marienberg",
    "lat": 47.368,
    "lon": 10.873,
    "sct": true,
    "ssc": false,
    "region": "Tirol",
    "country": "Austria",
    "website": "https://www.bergbahnen-langes.at",
    "groupId": "bergbahnen-langes",
    "groupName": "Lermoos - Grubigstein",
    "entryType": "entry",
    "entryName": "Biberwier"
  },
  {
    "name": "Brauneck – Lenggries",
    "lat": 47.666,
    "lon": 11.553,
    "sct": false,
    "ssc": false,
    "region": "Bavaria",
    "country": "Germany",
    "nearMuc": true,
    "website": "https://www.brauneck-bergbahn.de",
    "groupId": "brauneck-bergbahn",
    "groupName": "Brauneck - Lenggries",
    "entryType": "main",
    "entryName": "Brauneck"
  },
  {
    "name": "Buchensteinwand – Pillersee",
    "lat": 47.497,
    "lon": 12.576,
    "sct": true,
    "ssc": false,
    "region": "Tirol",
    "country": "Austria",
    "website": "https://www.bergbahn-pillersee.com",
    "groupId": "bergbahn-pillersee",
    "groupName": "Buchensteinwand - Pillersee",
    "entryType": "main",
    "entryName": "Buchensteinwand"
  },
  {
    "name": "Ehrwald – Ehrwalder Alm",
    "lat": 47.41,
    "lon": 10.92,
    "sct": true,
    "ssc": false,
    "region": "Tirol",
    "country": "Austria",
    "website": "https://www.almbahn.at",
    "groupId": "almbahn",
    "groupName": "Ehrwalder Alm",
    "entryType": "entry",
    "entryName": "Ehrwald"
  },
  {
    "name": "Elferbahnen – Neustift",
    "lat": 47.109,
    "lon": 11.309,
    "sct": true,
    "ssc": false,
    "region": "Tirol",
    "country": "Austria",
    "website": "https://www.stubai.at/skigebiete/elferbahnen",
    "groupId": "stubai",
    "groupName": "Schlick 2000",
    "entryType": "entry",
    "entryName": "Elferbahnen"
  },
  {
    "name": "Kaunertaler Gletscher",
    "lat": 46.882,
    "lon": 10.718,
    "sct": true,
    "ssc": false,
    "nearMuc": false,
    "glacier": true,
    "website": "https://www.kaunertaler-gletscher.at/bergbahnen-fendels.html",
    "groupId": "kaunertaler-gletscher",
    "groupName": "Kaunertaler Gletscher",
    "entryType": "main",
    "entryName": "Kaunertaler Gletscher"
  },
  {
    "name": "Galsterberg",
    "lat": 47.385,
    "lon": 13.944,
    "sct": false,
    "ssc": true,
    "region": "Styria",
    "country": "Austria",
    "website": "https://www.galsterberg.at",
    "groupId": "galsterberg",
    "groupName": "Galsterberg",
    "entryType": "main",
    "entryName": "Galsterberg"
  },
  {
    "name": "Garmisch-Classic",
    "lat": 47.492,
    "lon": 11.118,
    "sct": false,
    "ssc": false,
    "region": "Bavaria",
    "country": "Germany",
    "nearMuc": true,
    "website": "https://zugspitze.de",
    "groupId": "zugspitze",
    "groupName": "Zugspitze",
    "entryType": "entry",
    "entryName": "Garmisch-Classic"
  },
  {
    "name": "Gastein – Bad Gastein",
    "lat": 47.116,
    "lon": 13.134,
    "sct": false,
    "ssc": true,
    "region": "Salzburg",
    "country": "Austria",
    "website": "https://www.skigastein.com",
    "groupId": "skigastein",
    "groupName": "Sportgastein",
    "entryType": "entry",
    "entryName": "Gastein"
  },
  {
    "name": "Gastein – Bad Hofgastein",
    "lat": 47.171,
    "lon": 13.1,
    "sct": false,
    "ssc": true,
    "region": "Salzburg",
    "country": "Austria",
    "website": "https://www.skigastein.com",
    "groupId": "skigastein",
    "groupName": "Sportgastein",
    "entryType": "entry",
    "entryName": "Gastein"
  },
  {
    "name": "Gerlitzen Alpe",
    "lat": 46.669,
    "lon": 13.894,
    "sct": false,
    "ssc": true,
    "region": "Carinthia",
    "country": "Austria",
    "website": "https://www.gerlitzen.com",
    "groupId": "gerlitzen",
    "groupName": "Gerlitzen Alpe",
    "entryType": "main",
    "entryName": "Gerlitzen Alpe"
  },
  {
    "name": "Glungezer – Tulfes",
    "lat": 47.235,
    "lon": 11.522,
    "sct": true,
    "ssc": false,
    "region": "Tirol",
    "country": "Austria",
    "website": "https://www.glungezerbahn.at",
    "groupId": "glungezerbahn",
    "groupName": "Glungezer - Tulfes",
    "entryType": "main",
    "entryName": "Glungezer"
  },
  {
    "name": "Goldeck – Spittal/Drau",
    "lat": 46.797,
    "lon": 13.476,
    "sct": false,
    "ssc": true,
    "region": "Carinthia",
    "country": "Austria",
    "website": "https://www.sportberg-goldeck.com",
    "groupId": "sportberg-goldeck",
    "groupName": "Goldeck - Spittal/Drau",
    "entryType": "main",
    "entryName": "Goldeck"
  },
  {
    "name": "Grebenzen – St. Lambrecht",
    "lat": 47.07,
    "lon": 14.34,
    "sct": false,
    "ssc": true,
    "region": "Styria",
    "country": "Austria",
    "website": "https://grebenzen.at",
    "groupId": "grebenzen",
    "groupName": "Grebenzen - St. Lambrecht",
    "entryType": "main",
    "entryName": "Grebenzen"
  },
  {
    "name": "Großglockner Resort Kals–Matrei",
    "lat": 46.999,
    "lon": 12.562,
    "sct": true,
    "ssc": false,
    "region": "Tyrol",
    "country": "Austria",
    "website": "https://www.gg-resort.at",
    "groupId": "gg-resort",
    "groupName": "Großglockner Resort Kals-Matrei",
    "entryType": "main",
    "entryName": "Großglockner Resort Kals–Matrei"
  },
  {
    "name": "Hauser Kaibling",
    "lat": 47.401,
    "lon": 13.83,
    "sct": false,
    "ssc": true,
    "region": "Styria",
    "country": "Austria",
    "website": "https://www.hauser-kaibling.at",
    "groupId": "hauser-kaibling",
    "groupName": "Hauser Kaibling",
    "entryType": "main",
    "entryName": "Hauser Kaibling"
  },
  {
    "name": "Heiligenblut – Großglockner",
    "lat": 47.037,
    "lon": 12.846,
    "sct": false,
    "ssc": true,
    "region": "Carinthia",
    "country": "Austria",
    "website": "https://www.heiligenblut.at",
    "groupId": "heiligenblut",
    "groupName": "Heiligenblut - Großglockner",
    "entryType": "main",
    "entryName": "Heiligenblut"
  },
  {
    "name": "Hinterstoder – Höss",
    "lat": 47.696,
    "lon": 14.158,
    "sct": false,
    "ssc": true,
    "region": "Upper Austria",
    "country": "Austria",
    "website": "https://www.hinterstoder.at",
    "groupId": "hinterstoder",
    "groupName": "Hinterstoder - Höss",
    "entryType": "main",
    "entryName": "Hinterstoder"
  },
  {
    "name": "Hintertuxer Gletscher",
    "lat": 47.074,
    "lon": 11.664,
    "sct": true,
    "ssc": false,
    "region": "Tyrol",
    "country": "Austria",
    "glacier": true,
    "website": "https://www.hintertuxergletscher.at",
    "groupId": "hintertuxergletscher",
    "groupName": "Eggalmbahnen",
    "entryType": "entry",
    "entryName": "Hintertuxer Gletscher"
  },
  {
    "name": "Hochficht (Böhmerwald)",
    "lat": 48.732,
    "lon": 13.913,
    "sct": false,
    "ssc": true,
    "region": "Upper Austria",
    "country": "Austria",
    "website": "https://www.hochficht.at",
    "groupId": "hochficht",
    "groupName": "Hochficht (Böhmerwald)",
    "entryType": "main",
    "entryName": "Hochficht (Böhmerwald)"
  },
  {
    "name": "Hochkönig – Maria Alm/Dienten/Mühlbach",
    "lat": 47.391,
    "lon": 13.103,
    "sct": false,
    "ssc": true,
    "region": "Salzburg",
    "country": "Austria",
    "website": "https://www.hochkoenig.at",
    "groupId": "hochkoenig",
    "groupName": "Hochkönig - Maria Alm/Dienten/Mühlbach",
    "entryType": "main",
    "entryName": "Hochkönig"
  },
  {
    "name": "Hochkössen (Unterberghorn)",
    "lat": 47.674,
    "lon": 12.423,
    "sct": true,
    "ssc": false,
    "region": "Tirol",
    "country": "Austria",
    "website": "https://www.bergbahnen-koessen.at",
    "groupId": "bergbahnen-koessen",
    "groupName": "Hochkössen (Unterberghorn)",
    "entryType": "main",
    "entryName": "Hochkössen (Unterberghorn)"
  },
  {
    "name": "Hochwurzen",
    "lat": 47.367,
    "lon": 13.72,
    "sct": false,
    "ssc": true,
    "region": "Styria",
    "country": "Austria",
    "website": "https://www.planai.at",
    "groupId": "planai",
    "groupName": "Hochwurzen",
    "entryType": "main",
    "entryName": "Hochwurzen"
  },
  {
    "name": "Hochzeiger – Jerzens Pitztal",
    "lat": 47.1516147,
    "lon": 10.757664,
    "sct": true,
    "ssc": false,
    "region": "Tyrol",
    "country": "Austria",
    "website": "https://www.hochzeiger.com",
    "groupId": "hochzeiger",
    "groupName": "Hochzeiger - Jerzens Pitztal",
    "entryType": "main",
    "entryName": "Hochzeiger"
  },
  {
    "name": "Jenner – Königssee",
    "lat": 47.583,
    "lon": 12.996,
    "sct": false,
    "ssc": true,
    "region": "Bavaria",
    "country": "Germany",
    "nearMuc": true,
    "website": "https://www.jennerbahn.de",
    "groupId": "jennerbahn",
    "groupName": "Jenner - Königssee",
    "entryType": "main",
    "entryName": "Jenner"
  },
  {
    "name": "Kappl",
    "lat": 47.069,
    "lon": 10.376,
    "sct": true,
    "ssc": false,
    "region": "Tyrol",
    "country": "Austria",
    "website": "https://www.kappl.com",
    "groupId": "kappl",
    "groupName": "Kappl",
    "entryType": "main",
    "entryName": "Kappl"
  },
  {
    "name": "Kaprun – Kitzsteinhorn (Gletscher)",
    "lat": 47.219,
    "lon": 12.759,
    "sct": false,
    "ssc": true,
    "glacier": true,
    "region": "Salzburg",
    "country": "Austria",